{
  "schema_version": "city-airport-quarterly-operations-parameter-schema-v1",
  "schema_id": "city_airport_quarterly_operations_parameter_schema_v1",
  "description": "Variable skeleton for city airport quarterly operations configs. This file documents required variables, units, and tuning intent only; it is not loaded by the simulator.",
  "required_top_level_fields": [
    "schema_version",
    "config_version",
    "city_airport_market_id",
    "city_name",
    "currency",
    "amount_unit",
    "game_timeline",
    "quarter_component_weights",
    "facility_fixed_operating_cost_million_cny_per_year",
    "slot_fixed_operating_cost_model",
    "facility_renovation_model",
    "facility_renovation_events",
    "facility_construction_model",
    "facility_construction_events",
    "facility_rebuild_model",
    "facility_rebuild_events",
    "aeronautical_revenue",
    "passenger_variable_cost",
    "congestion_cost",
    "commercial"
  ],
  "parameters": {
    "game_timeline": {
      "unit": "years",
      "shape": "simulation_start_year + startup_operating_history_years + player_decision_start_year",
      "city_tuning_priority": "high",
      "city_tuning_note": "城市季度经营的游戏时间入口。建议正式玩法先自动运营若干年形成历史记录，再进入玩家决策期；北京默认 2025-2029 为开局经营记录，2030 开始玩家决策。"
    },
    "quarter_component_weights": {
      "unit": "share_of_annual_component_passengers",
      "shape": "component -> four quarterly weights",
      "components": ["business", "leisure", "vfr", "long_haul", "transfer"],
      "constraint": "Each component's four quarterly weights should sum to 1.0.",
      "city_tuning_priority": "high",
      "city_tuning_note": "商务、休闲、探亲、长途和中转可有不同季节性。城市季度经营层承接上游年度城市客流和客群分项，再按这里拆成季度。"
    },
    "facility_fixed_operating_cost_million_cny_per_year": {
      "unit": "million_cny_per_year",
      "shape": "facility_size -> fixed operating cost",
      "facility_sizes": ["empty", "small", "medium", "large", "extra_large", "giant"],
      "city_tuning_priority": "high",
      "city_tuning_note": "启用槽位产生的基础固定经营成本，不是折旧。应按城市人工、能源、安全、管理复杂度和机场规模调制。"
    },
    "slot_fixed_operating_cost_model": {
      "unit": "mixed",
      "city_tuning_priority": "high",
      "city_tuning_note": "在规格基准成本上叠加建筑年龄、季度暖通能耗、宏观成本压力和城市复杂度。slot_open_years 应逐城市按槽位填写；age_curve_points 可区域共用；quarter_cost_multipliers 应四季平均约为 1.0；macro_cost_pressure 使用上游城市/区域传入的宏观字段。"
    },
    "slot_fixed_operating_cost_model.macro_cost_pressure.weights": {
      "unit": "weighted_index",
      "shape": "upstream_city_airport_demand_field -> weight",
      "recommended_upstream_fields": [
        "input_core_inflation_cost_index",
        "input_energy_cost_pressure_index",
        "input_currency_pressure_index",
        "input_regional_macro_stress_index",
        "input_headline_inflation_cost_index"
      ],
      "city_tuning_priority": "medium",
      "city_tuning_note": "固定经营成本的宏观压力入口。字段由城市机场需求层从区域宏观层传入；北京当前覆盖值以通胀、能源、汇率和宏观压力为主，不直接把旅客信心当作成本项。"
    },
    "facility_renovation_model": {
      "unit": "mixed",
      "shape": "standard slot renovation rules: duration, construction capacity multiplier, capex ratio, depreciation, effective maintenance age reduction",
      "city_tuning_priority": "high",
      "city_tuning_note": "现有航站楼翻新机制模板。翻新不等于扩容，不改变槽位规格；施工期只降低该槽位有效容量，完工后新增翻新资产并单独折旧，同时把固定经营成本读取的有效维护年龄按比例降低。"
    },
    "facility_renovation_model.default_construction_capacity_multiplier": {
      "unit": "multiplier",
      "city_tuning_priority": "medium",
      "city_tuning_note": "施工期该槽位设计容量和最大容量的可用比例。第一版建议统一使用 0.75，表达同等规模翻新的容量扰动；不同规格主要通过工期和投资额区分。"
    },
    "facility_renovation_model.maintenance_age_retention_ratio": {
      "unit": "multiplier",
      "city_tuning_priority": "medium",
      "city_tuning_note": "翻新完工后有效维护年龄的保留比例。北京默认 0.55，即 34 年老楼翻新后按约 19 年有效维护年龄读取固定成本曲线，而不是归零。"
    },
    "facility_renovation_model.minimum_effective_maintenance_age_years": {
      "unit": "years",
      "city_tuning_priority": "medium",
      "city_tuning_note": "翻新后的有效维护年龄下限，避免频繁翻新把老航站楼洗成全新资产。北京默认 5 年。"
    },
    "facility_renovation_model.replacement_cost_million_cny_by_facility_size": {
      "unit": "million_cny",
      "shape": "facility_size -> replacement cost",
      "city_tuning_priority": "high",
      "city_tuning_note": "各规格航站楼的游戏口径重置成本。翻新费用默认按该重置成本乘 capex_ratio_by_facility_size 计算；城市可用 city_construction_cost_multiplier 或事件级 capex_million_cny 覆盖。"
    },
    "facility_renovation_model.duration_quarters_by_facility_size": {
      "unit": "quarters",
      "shape": "facility_size -> construction duration",
      "city_tuning_priority": "high",
      "city_tuning_note": "不同规格的默认翻新工期。容量折损比例可以相同，但大规格项目持续时间更长。"
    },
    "facility_renovation_model.renovation_asset_depreciation": {
      "unit": "years_and_pct",
      "shape": "useful_life_years + residual_value_pct",
      "city_tuning_priority": "medium",
      "city_tuning_note": "翻新投资完工转固后的独立资产折旧参数。第一版不清理旧资产，旧航站楼资产继续折旧，新增翻新资产单独折旧。"
    },
    "facility_renovation_events": {
      "unit": "event_list",
      "shape": "event_id, airport_id, slot_id, facility_size, start_year, start_quarter, optional overrides",
      "city_tuning_priority": "high",
      "city_tuning_note": "城市具体翻新项目列表。默认只需填槽位、规格和开始季度；可覆盖 duration_quarters、construction_capacity_multiplier、capex_million_cny、useful_life_years、residual_value_pct。"
    },
    "facility_construction_model": {
      "unit": "mixed",
      "shape": "new terminal construction rules: capex, duration, completion asset depreciation",
      "city_tuning_priority": "high",
      "city_tuning_note": "新建航站楼机制模板。新建只用于 empty 槽位，施工期不增加容量；完工后城市机场客流配置应通过 open_year 暴露该槽位，季度经营层记录建设期资本开支、在建工程、完工后的新建资产折旧。"
    },
    "facility_construction_model.construction_cost_million_cny_by_facility_size": {
      "unit": "million_cny",
      "shape": "facility_size -> new-build construction cost",
      "city_tuning_priority": "high",
      "city_tuning_note": "各规格航站楼完整新建造价，和翻新 replacement_cost 使用同一 2025 不变价游戏口径。城市可用 city_construction_cost_multiplier 或事件级 capex_million_cny 覆盖。"
    },
    "facility_construction_model.duration_quarters_by_facility_size": {
      "unit": "quarters",
      "shape": "facility_size -> construction duration",
      "city_tuning_priority": "high",
      "city_tuning_note": "不同规格的新建标准工期。北京样板 PKX_SLOT_2 使用 large 标准工期 14 季度。"
    },
    "facility_construction_model.new_asset_depreciation": {
      "unit": "years_and_pct",
      "shape": "useful_life_years + residual_value_pct",
      "city_tuning_priority": "medium",
      "city_tuning_note": "新建航站楼完工转固后的资产折旧参数。第一版建议 40 年、10% 残值。"
    },
    "facility_construction_events": {
      "unit": "event_list",
      "shape": "event_id, airport_id, slot_id, target_facility_size, start_year, start_quarter, optional overrides",
      "city_tuning_priority": "high",
      "city_tuning_note": "城市具体新建航站楼项目列表。默认只需填空槽位、目标规格和开始季度；可覆盖 duration_quarters、capex_million_cny、construction_cost_multiplier、useful_life_years、residual_value_pct。"
    },
    "facility_rebuild_model": {
      "unit": "mixed",
      "shape": "existing slot demolition and rebuild rules: full slot closure during construction, construction capex, demolition expense, duration, asset depreciation",
      "city_tuning_priority": "high",
      "city_tuning_note": "拆除重建用于已启用槽位。v0.1 施工期该槽位有效容量固定归零；建造费用资本化为重建资产，拆除费用当期费用化，原初始资产和同槽位已完工翻新资产在重建开始时核销。区域、城市和事件差异主要通过工期、建造费和拆除费表达。"
    },
    "facility_rebuild_model.asset_cost_million_cny_by_facility_size": {
      "unit": "million_cny",
      "shape": "target_facility_size -> rebuild construction capex",
      "city_tuning_priority": "high",
      "city_tuning_note": "重建后的新航站楼建造费用。默认可沿用新建造价，但区域和城市可按施工难度、土地限制、不停航组织和供应链成本调整；事件级 asset_capex_million_cny 或 capex_million_cny 可覆盖。"
    },
    "facility_rebuild_model.demolition_cost_ratio_by_source_facility_size": {
      "unit": "ratio",
      "shape": "source_facility_size -> demolition expense ratio",
      "city_tuning_priority": "high",
      "city_tuning_note": "拆除费用按被拆旧规格的资产成本乘比例估算。它是期间费用，不形成新资产；不同区域、城市和槽位的拆除难度差异应通过 city_demolition_cost_multiplier 或事件级 demolition_expense_million_cny 覆盖。"
    },
    "facility_rebuild_model.duration_quarters_by_facility_size": {
      "unit": "quarters",
      "shape": "target_facility_size -> rebuild duration",
      "city_tuning_priority": "high",
      "city_tuning_note": "拆除重建标准工期，通常比纯新建更长或更复杂。区域、城市和事件都可以覆盖。"
    },
    "facility_rebuild_events": {
      "unit": "event_list",
      "shape": "event_id, airport_id, slot_id, from_facility_size, target_facility_size, start_year, start_quarter, optional overrides",
      "city_tuning_priority": "high",
      "city_tuning_note": "城市具体拆除重建项目列表。重建事件不能和同槽位翻新/重建事件施工窗口重叠；可覆盖 duration_quarters、asset_capex_million_cny、demolition_expense_million_cny、construction_cost_multiplier、demolition_cost_multiplier、useful_life_years、residual_value_pct。施工期容量不做事件级覆盖，固定归零。"
    },
    "upstream_macro_fields_from_city_airport_demand": {
      "unit": "pass_through_or_derived_index",
      "shape": "field list",
      "fields": [
        "input_regional_gdp_index",
        "input_regional_gdp_growth_pct",
        "input_regional_output_gap_pct",
        "input_headline_inflation_pct",
        "input_core_inflation_pct",
        "input_headline_inflation_cost_index",
        "input_core_inflation_cost_index",
        "input_energy_cost_pressure_index",
        "input_10y_yield_pct",
        "input_hy_spread_bps",
        "input_equity_return_pct",
        "input_equity_valuation_pe",
        "input_regional_macro_stress_index"
      ],
      "city_tuning_priority": "medium",
      "city_tuning_note": "这些不是逐城市手填参数，而是城市机场需求层按 seed/year/历史岔路从区域宏观层带下来的桥接字段。城市经营配置可以选择其中一部分进入成本或收入黑箱。"
    },
    "aeronautical_revenue.base_revenue_per_passenger_cny": {
      "unit": "cny_per_served_passenger",
      "city_tuning_priority": "medium",
      "city_tuning_note": "航运侧旅客收费基准，受机场收费水平、国内国际结构、枢纽议价能力影响。"
    },
    "aeronautical_revenue.component_mix_revenue_weights": {
      "unit": "multiplier",
      "shape": "component -> revenue multiplier",